0,rna.EB13*,"Kristen, son of Geoffrey, grandson of Andrew",55,33,3.3004081632653355,98890.0
1,rna.EB27*,"Louis, son of Virginia, grandson of Geoffrey",56,34,2.8824489795918646,98181.0
2,rna.EB19*,"Ronald, son of Terence, grandson of Catherine",55,32,2.523265306122473,98139.0
3,rna.EB43*,"Katherine, son of Natasha, grandson of Raymond",57,34,2.4432653061224716,97154.0
4,rna.EB38*,"Jeffrey, son of Maria, grandson of Montgomery",53,33,2.4783673469387986,96386.0
5,rna.EB40*,"Spencer, son of Raymond, grandson of Nicholas",61,33,2.566530612244922,96895.0
6,rna.EB6*,"Francesca, son of Jerome, grandson of Amanda",57,35,2.5428571428571667,96860.0
7,rna.EB18*,"Geoffrey, son of William, grandson of John",52,37,2.4481632653061456,96577.0
8,rna.EB44*,"Andrew, son of Augustine, grandson of Bonnie",55,34,2.430204081632675,96842.0
9,rna.EB1*,"Joseph, son of William, grandson of Gertrude",49,33,2.4946938775510428,96848.0
10,rna.EB4*,"Franklin, son of Mitchell, grandson of Herbert",58,33,2.498775510204105,96119.0
11,rna.EB40*,"Geoffrey, son of Martin, grandson of Janet",56,37,2.4791836734694104,97538.0
12,rna.EB25*,"Zachary, son of Paula, grandson of Zachary",59,37,2.52979591836737,96553.0
13,rna.EB19*,"Thomas, son of Arthur, grandson of Susan",61,39,2.5461224489796157,97066.0
14,rna.EB40*,"Simon, son of Gertrude, grandson of Calvin",54,34,2.528163265306146,97343.0
15,rna.EB9*,"Theresa, son of Steven, grandson of Gertrude",57,38,2.4628571428571657,97097.0
16,rna.EB23*,"Andrew, son of Calvin, grandson of Simon",63,38,2.479183673469411,96732.0
17,rna.EB36*,"Hilary, son of Steven, grandson of Percival",59,38,2.6236734693877795,96875.0
18,rna.EB5*,"Beverley, son of Thomas, grandson of Ronald",56,38,2.6228571428571676,96927.0
19,rna.EB38*,"Geoffrey, son of Vincent, grandson of John",59,40,2.5616326530612485,96716.0
20,rna.EB6*,"Teresa, son of Virginia, grandson of Michelle",58,39,2.53714285714288,97028.0
21,rna.EB43*,"Alan, son of Christine, grandson of Virginia",56,35,2.5134693877551255,96648.0
22,rna.EB21*,"Bartholomew, son of Richard, grandson of Christine",54,36,2.606530612244922,96842.0
23,rna.EB48*,"Montgomery, son of Regina, grandson of Thomas",58,34,2.590204081632677,96742.0
24,rna.EB43*,"Isabella, son of Martin, grandson of Terence",60,35,2.557551020408187,97156.0
25,rna.EB34*,"Geoffrey, son of Susan, grandson of Montgomery",58,35,2.5338775510204314,96753.0
26,rna.EB18*,"Elizabeth, son of William, grandson of Steven",61,37,2.4106122448979814,96945.0
27,rna.EB13*,"Walter, son of Margaret, grandson of Nigel",52,35,2.4040816326530834,96945.0
28,rna.EB40*,"Andrew, son of Barnaby, grandson of John",58,35,2.4832653061224725,96761.0
29,rna.EB8*,"Katherine, son of Theresa, grandson of Barnaby",58,37,2.521632653061248,96967.0
30,rna.EB39*,"Jerome, son of Pauline, grandson of Theresa",57,36,2.5012244897959417,96704.0
31,rna.EB6*,"Margaret, son of Terence, grandson of Hilary",58,37,2.462040816326554,96187.0
32,rna.EB8*,"Peter, son of Rodney, grandson of Dominic",58,36,2.483265306122472,96836.0
33,rna.EB43*,"Tamsin, son of Beverley, grandson of Eugene",54,35,2.4783673469387986,96775.0
34,rna.EB16*,"Roderick, son of David, grandson of Alan",58,38,2.525714285714309,96875.0
35,rna.EB23*,"Thomas, son of Charles, grandson of William",56,37,2.487346938775534,96394.0
36,rna.EB44*,"Alfred, son of Samuel, grandson of Helen",56,38,2.482448979591859,95987.0
37,rna.EB18*,"Henry, son of William, grandson of Virginia",58,38,2.5493877551020643,96864.0
38,rna.EB5*,"Donald, son of Samantha, grandson of Gerald",55,34,2.5102040816326765,97016.0
39,rna.EB6*,"Miranda, son of Antoinette, grandson of Francesco",58,37,2.4718367346939014,96864.0
40,rna.EB49*,"Victoria, son of Terence, grandson of Antoinette",57,39,2.525714285714309,95468.0
41,rna.EB23*,"Trenton, son of Vincent, grandson of Dwight",57,41,2.612244897959208,96474.0
42,rna.EB2*,"Augustus, son of Susan, grandson of Nichole",55,34,2.531428571428595,96716.0
43,rna.EB44*,"Zachary, son of Walter, grandson of Thomas",58,39,2.5559183673469623,96420.0
44,rna.EB25*,"Nichola, son of Elaine, grandson of Josephine",56,39,2.506938775510228,96256.0
45,rna.EB26*,"Cassandra, son of Augustus, grandson of Alan",58,37,2.492244897959207,95745.0
46,rna.EB9*,"Trenton, son of Albert, grandson of Samantha",58,35,2.5200000000000236,96135.0
47,rna.EB44*,"Peter, son of Geoffrey, grandson of Cassandra",55,34,2.500408163265329,96368.0
48,rna.EB5*,"William, son of Raphael, grandson of Maria",56,36,2.5012244897959413,96558.0
49,rna.EB14*,"Susan, son of Carolyn, grandson of Priscilla",62,37,2.491428571428595,95760.0
50,rna.EB47*,"Nichole, son of Miranda, grandson of Nathaniel",58,36,2.58775510204084,96691.0
51,rna.EB37*,"Victor, son of Thomas, grandson of Miranda",62,33,2.4669387755102266,95649.0
52,rna.EB39*,"Harold, son of Ronald, grandson of Jeremy",55,33,2.4963265306122677,95603.0
53,rna.EB39*,"Nichola, son of Victoria, grandson of Geoffrey",52,35,2.52979591836737,96589.0
54,rna.EB12*,"Christopher, son of Tobias, grandson of Andrew",54,39,2.5420408163265544,96582.0
55,rna.EB24*,"Jordan, son of Christopher, grandson of Tobias",63,38,2.596734693877575,95762.0
56,rna.EB20*,"Raphael, son of Lucille, grandson of Alexandra",53,37,2.593469387755126,97037.0
57,rna.EB25*,"Eleanor, son of Bonnie, grandson of Bartholomew",53,37,2.48979591836737,96445.0
58,rna.EB38*,"Judith, son of Abraham, grandson of Antoinette",52,34,2.535510204081656,95939.0
59,rna.EB23*,"Stephen, son of Judith, grandson of Abraham",57,34,2.55510204081635,95869.0
60,rna.EB11*,"Montague, son of Herbert, grandson of Victor",57,36,2.498775510204105,97050.0
61,rna.EB49*,"Theodore, son of Teresa, grandson of Michelle",58,39,2.5591836734694113,96734.0
62,rna.EB26*,"Virginia, son of Bridget, grandson of Katrina",55,37,2.548571428571452,95813.0
63,rna.EB28*,"William, son of Virginia, grandson of Bridget",55,36,2.6457142857143103,97073.0
64,rna.EB38*,"Victor, son of Ronald, grandson of Christopher",60,37,2.5632653061224726,96905.0
65,rna.EB47*,"Jason, son of Richard, grandson of Matthew",53,35,2.4710204081632883,96168.0
66,rna.EB27*,"Violet, son of Virginia, grandson of Geoffrey",57,35,2.542857142857166,96154.0
67,rna.EB45*,"Charles, son of Andrew, grandson of Geoffrey",60,34,2.569795918367371,97245.0
68,rna.EB24*,"Ethel, son of Dolores, grandson of Teresa",55,33,2.4628571428571653,97192.0
69,rna.EB34*,"Jeremiah, son of John, grandson of Eleanor",56,36,2.5951020408163505,96804.0
70,rna.EB3*,"Matthew, son of Edmund, grandson of Ethel",55,39,2.641632653061249,96078.0
71,rna.EB20*,"Catherine, son of David, grandson of Maria",58,39,2.570612244897983,96784.0
72,rna.EB18*,"Russell, son of Spencer, grandson of Jacob",54,39,2.5485714285714516,96937.0
73,rna.EB49*,"Vincent, son of Barbara, grandson of Thomas",58,39,2.5436734693877794,97316.0
74,rna.EB3*,"Samuel, son of Peter, grandson of Seymour",56,38,2.4987755102041045,95915.0
75,rna.EB25*,"Elizabeth, son of Steven, grandson of Anne",59,43,2.5575510204081864,96343.0
76,rna.EB10*,"Francesco, son of Violet, grandson of Nicholas",58,37,2.570612244897983,96301.0
77,rna.EB10*,"Abraham, son of Gertrude, grandson of Emily",61,37,2.6040816326530853,97212.0
78,rna.EB12*,"Russell, son of Steven, grandson of Helen",63,39,2.5363265306122686,96790.0
79,rna.EB15*,"Edmund, son of Ethel, grandson of Edward",58,35,2.3665306122449197,96871.0
80,rna.EB35*,"Arnold, son of Francesca, grandson of Geoffrey",54,38,2.4971428571428804,97393.0
81,rna.EB10*,"Sarah, son of Michelle, grandson of Barbara",55,33,2.6742857142857392,97541.0
82,rna.EB19*,"Tamsin, son of Maria, grandson of Theodore",55,35,2.6163265306122687,96857.0
83,rna.EB31*,"Trenton, son of Alexander, grandson of Judith",54,37,2.491428571428595,97159.0
84,rna.EB34*,"Aloysius, son of Rachel, grandson of Norbert",54,39,2.4775510204081863,97027.0
85,rna.EB20*,"Victor, son of Mary, grandson of Cassandra",56,39,2.548571428571452,97103.0
86,rna.EB30*,"Theodore, son of Virginia, grandson of Gertrude",57,39,2.5322448979592083,96773.0
87,rna.EB48*,"Alan, son of Simon, grandson of Victor",58,39,2.5608163265306367,96453.0
88,rna.EB43*,"Alan, son of Ethel, grandson of Montague",58,39,2.5175510204081863,96988.0
89,rna.EB42*,"Katrina, son of Ronald, grandson of Tobias",53,38,2.4889795918367574,96998.0
90,rna.EB30*,"Bonnie, son of Susan, grandson of Joshua",55,40,2.5469387755102275,97553.0
91,rna.EB45*,"Helen, son of Elizabeth, grandson of Teresa",55,41,2.561632653061248,97549.0
92,rna.EB4*,"Renee, son of Charles, grandson of Renee",55,43,2.521632653061248,97219.0
93,rna.EB1*,"Teresa, son of Bartholomew, grandson of David",57,38,2.5134693877551255,97454.0
94,rna.EB39*,"Arthur, son of Steven, grandson of Andrew",55,39,2.5281632653061457,97138.0
95,rna.EB28*,"Sharon, son of Angus, grandson of Vincent",55,42,2.538775510204105,97113.0
96,rna.EB44*,"Peter, son of Clayton, grandson of Michele",56,39,2.5404081632653295,97390.0
97,rna.EB39*,"Abigail, son of Robert, grandson of Virginia",58,38,2.596734693877575,97489.0
98,rna.EB5*,"Janice, son of David, grandson of Simon",57,36,2.5918367346939015,97667.0
99,rna.EB3*,"Ellen, son of Jennifer, grandson of Amanda",64,36,2.5779591836734936,97598.0
100,rna.EB19*,"Margaret, son of Edmund, grandson of Walter",57,38,2.6040816326530853,95923.0
101,rna.EB49*,"Norbert, son of Renee, grandson of Gustav",54,38,2.64571428571431,96999.0
102,rna.EB15*,"Franklin, son of Montmorency, grandson of Jane",55,40,2.72163265306125,96443.0
103,rna.EB43*,"Theodore, son of Virginia, grandson of Montmorency",55,38,2.6432653061224736,97579.0
104,rna.EB47*,"Albert, son of Christopher, grandson of Virginia",59,38,2.551020408163289,97831.0
105,rna.EB38*,"Patricia, son of Tamsin, grandson of Renee",55,35,2.463673469387778,97653.0
106,rna.EB2*,"Robert, son of Peter, grandson of John",57,38,2.4914285714285946,97386.0
107,rna.EB35*,"Walter, son of Sharon, grandson of Jennifer",58,41,2.4097959183673696,97128.0
108,rna.EB16*,"Alan, son of Theresa, grandson of Joel",58,43,2.4514285714285937,97500.0
109,rna.EB27*,"William, son of Joshua, grandson of Christine",54,37,2.53714285714288,97158.0
110,rna.EB43*,"Virginia, son of William, grandson of Joshua",57,36,2.6040816326530853,97049.0
111,rna.EB29*,"Russell, son of Alfred, grandson of Victor",58,40,2.626938775510229,97510.0
112,rna.EB29*,"Martin, son of Eugene, grandson of Russell",55,37,2.6310204081632893,97532.0
113,rna.EB4*,"Franklin, son of Walter, grandson of Jane",53,35,2.606530612244922,97000.0
114,rna.EB25*,"Mary, son of Jeremiah, grandson of Thomas",57,35,2.5714285714285956,96258.0
115,rna.EB8*,"Priscilla, son of Gertrude, grandson of Adelaida",55,34,2.471020408163288,97556.0
116,rna.EB21*,"Bartholomew, son of Priscilla, grandson of Gertrude",61,36,2.5257142857143084,97606.0
117,rna.EB21*,"Susan, son of Theodore, grandson of Tobias",54,36,2.5714285714285956,96642.0
118,rna.EB37*,"Roderick, son of Jeremiah, grandson of Christine",58,34,2.5444897959183908,97483.0
119,rna.EB35*,"William, son of Leonardo, grandson of Victoria",55,38,2.5910204081632893,97739.0
120,rna.EB45*,"Robert, son of Elaine, grandson of Spencer",55,39,2.444081632653084,97311.0
121,rna.EB16*,"Beverley, son of Virginia, grandson of Rodney",58,37,2.4465306122449206,97629.0
122,rna.EB9*,"Anne, son of Christine, grandson of Regina",59,38,2.4685714285714524,97480.0
123,rna.EB2*,"Regina, son of Carolyn, grandson of Bridget",54,35,2.5755102040816564,97466.0
124,rna.EB32*,"Abraham, son of Vincent, grandson of Theresa",59,39,2.5583673469387986,96533.0
125,rna.EB8*,"Abraham, son of Steven, grandson of Jane",57,39,2.459591836734717,97543.0
126,rna.EB18*,"William, son of Judith, grandson of Deborah",58,38,2.4351020408163486,97256.0
127,rna.EB24*,"Anthony, son of Virginia, grandson of Margaret",61,38,2.5444897959183908,97178.0
128,rna.EB17*,"Sarah, son of Augustine, grandson of Mary",55,39,2.6032653061224726,97372.0
129,rna.EB23*,"Katrina, son of Alfred, grandson of Michelle",62,34,2.4506122448979824,97361.0
130,rna.EB25*,"Susan, son of Roderick, grandson of Regina",56,35,2.528979591836758,96543.0
131,rna.EB30*,"Ronald, son of Arthur, grandson of Louis",58,35,2.4938775510204314,97315.0
132,rna.EB33*,"Maria, son of Abraham, grandson of Edward",58,34,2.48244897959186,97542.0
133,rna.EB25*,"Vincent, son of John, grandson of Judith",59,34,2.5346938775510437,97106.0
134,rna.EB22*,"Henry, son of Paul, grandson of Norbert",51,31,2.6163265306122687,96659.0
135,rna.EB28*,"Herbert, son of Steven, grandson of Jerome",58,36,2.6326530612245143,97275.0
136,rna.EB37*,"Bartholomew, son of Katrina, grandson of Edmund",57,35,2.5493877551020647,97022.0
137,rna.EB29*,"Edward, son of Bartholomew, grandson of Katrina",55,35,2.493877551020431,97263.0
138,rna.EB36*,"Elizabeth, son of Thomas, grandson of Barbara",54,36,2.5453061224490034,95772.0
139,rna.EB42*,"Trenton, son of Kenneth, grandson of Virginia",57,40,2.6130612244898206,96525.0
140,rna.EB22*,"Theresa, son of Victor, grandson of Jeremiah",52,33,2.498775510204105,97074.0
141,rna.EB39*,"Robert, son of Matthew, grandson of Victor",58,38,2.5346938775510437,97082.0
142,rna.EB21*,"Sarah, son of Elaine, grandson of Adelaida",62,37,2.566530612244922,96281.0
143,rna.EB27*,"Zachary, son of Stephen, grandson of Anthony",55,37,2.503673469387778,96820.0
144,rna.EB26*,"Edmund, son of Theodore, grandson of David",55,38,2.508571428571451,96356.0
145,rna.EB24*,"Ethel, son of Gustav, grandson of Theodore",55,35,2.6040816326530853,96927.0
146,rna.EB45*,"Oliver, son of Ethel, grandson of Gustav",56,35,2.682448979591862,97559.0
147,rna.EB21*,"Thomas, son of Christine, grandson of Arnold",57,34,2.5551020408163496,96375.0
148,rna.EB45*,"Arthur, son of Dominick, grandson of Catherine",56,39,2.546938775510228,97665.0
149,rna.EB42*,"Montgomery, son of Arnold, grandson of Stephen",58,38,2.593469387755126,97195.0
150,rna.EB15*,"Theodore, son of Jordan, grandson of Nathaniel",54,35,2.503673469387779,97263.0
151,rna.EB39*,"Augustus, son of Joel, grandson of Steven",54,37,2.484897959183696,97114.0
152,rna.EB14*,"Paul, son of Catherine, grandson of Montgomery",61,41,2.5257142857143093,97298.0
153,rna.EB23*,"Pauline, son of Michele, grandson of Megan",56,37,2.578775510204105,97481.0
154,rna.EB35*,"Jacob, son of Spencer, grandson of Rodney",58,35,2.537959183673493,97455.0
155,rna.EB22*,"Edward, son of Walter, grandson of William",64,34,2.5640816326530853,97389.0
156,rna.EB36*,"Kenneth, son of Richard, grandson of Zachary",57,36,2.5934693877551265,97390.0
157,rna.EB19*,"Nichola, son of Philippa, grandson of Edward",56,38,2.666938775510229,96805.0
158,rna.EB13*,"Steven, son of Alfred, grandson of Amanda",55,37,2.607346938775535,97617.0
159,rna.EB29*,"Thomas, son of Madison, grandson of Margaret",59,36,2.560000000000024,97659.0
160,rna.EB44*,"Lucille, son of Thomas, grandson of Madison",58,36,2.551836734693901,97582.0
161,rna.EB15*,"Charles, son of Charles, grandson of Thomas",59,30,2.6187755102041064,96717.0
162,rna.EB6*,"Valerie, son of Charles, grandson of Charles",56,36,2.5706122448979833,97722.0
163,rna.EB38*,"Edward, son of Peter, grandson of Megan",56,38,2.517551020408187,97475.0
164,rna.EB15*,"Miranda, son of Alfred, grandson of Anthony",54,39,2.582857142857167,97666.0
165,rna.EB15*,"Nichole, son of Eleanor, grandson of Arthur",54,33,2.5812244897959427,97753.0
166,rna.EB34*,"Bartholomew, son of Anthony, grandson of Leonardo",58,38,2.5942857142857383,97764.0
167,rna.EB31*,"Jeremiah, son of Thomas, grandson of Anthony",54,33,2.521632653061249,96703.0
168,rna.EB40*,"Franklin, son of Henry, grandson of Madison",55,37,2.5379591836734923,96676.0
169,rna.EB9*,"Dolores, son of Natasha, grandson of Simon",54,35,2.566530612244921,97657.0
170,rna.EB29*,"Terence, son of Gregory, grandson of Tamara",54,34,2.5902040816326766,97646.0
171,rna.EB48*,"Martin, son of Terence, grandson of Gregory",62,36,2.5559183673469628,96618.0
172,rna.EB30*,"Jacob, son of Lucille, grandson of Jeremy",55,36,2.5624489795918604,96647.0
173,rna.EB34*,"Victoria, son of Victoria, grandson of Daniel",59,37,2.5453061224490034,97756.0
174,rna.EB33*,"Percival, son of Michele, grandson of Bonnie",57,36,2.5297959183673706,97689.0
175,rna.EB18*,"Daniel, son of Patricia, grandson of William",55,34,2.452244897959207,98038.0
176,rna.EB35*,"Victor, son of Kimberly, grandson of Samantha",57,38,2.38122448979594,96781.0
177,rna.EB42*,"Helen, son of Regina, grandson of Kimberly",57,36,2.4816326530612476,97817.0
178,rna.EB13*,"Edward, son of Beverley, grandson of Ethel",56,36,2.430204081632676,97906.0
179,rna.EB7*,"Antoinette, son of Theodore, grandson of Douglas",58,39,2.4922448979592065,97918.0
180,rna.EB10*,"Thomas, son of Valerie, grandson of Priscilla",59,37,2.508571428571451,98082.0
181,rna.EB3*,"William, son of Susan, grandson of Madison",58,37,2.551836734693901,97979.0
182,rna.EB25*,"Andrew, son of Margaret, grandson of Seymour",59,38,2.448163265306145,98186.0
183,rna.EB14*,"Daniel, son of Abigail, grandson of Arthur",54,34,2.515918367346962,97845.0
184,rna.EB19*,"Donald, son of Daniel, grandson of Abigail",61,38,2.48979591836737,96856.0
185,rna.EB40*,"Nichole, son of Tamara, grandson of Maria",62,36,2.5077551020408397,98263.0
186,rna.EB16*,"David, son of Leonardo, grandson of Renee",55,38,2.4751020408163495,97699.0
187,rna.EB1*,"Alexandra, son of Carolyn, grandson of Janet",58,40,2.5028571428571658,98211.0
188,rna.EB47*,"Janice, son of Janet, grandson of Simon",58,42,2.530612244897983,97926.0
189,rna.EB41*,"Gustav, son of Virginia, grandson of Geoffrey",60,41,2.5983673469387996,97781.0
190,rna.EB20*,"Aloysius, son of Gustav, grandson of Virginia",58,40,2.5110204081632883,97319.0
191,rna.EB17*,"Victoria, son of Kenneth, grandson of Kimberly",57,39,2.4906122448979824,97740.0
192,rna.EB45*,"Ronald, son of James, grandson of Susan",65,40,2.4848979591836966,97145.0
193,rna.EB30*,"Louis, son of Kenneth, grandson of Edward",57,38,2.52979591836737,97907.0
194,rna.EB1*,"Spencer, son of Samantha, grandson of Edward",57,36,2.5591836734694113,97937.0
195,rna.EB0*,"Thomas, son of Helen, grandson of Jennifer",54,33,2.600816326530636,97065.0
196,rna.EB25*,"Jason, son of Samuel, grandson of Roderick",58,36,2.5493877551020647,96889.0
197,rna.EB2*,"Mathew, son of Deborah, grandson of Edwin",54,38,2.5077551020408397,98125.0
198,rna.EB26*,"Henry, son of Michele, grandson of Dorothy",59,38,2.5175510204081863,97092.0
199,rna.EB43*,"Geoffrey, son of Abigail, grandson of Violet",58,39,2.343673469387777,97670.0
200,rna.EB1*,"Anne, son of Thomas, grandson of Jeremy",55,36,2.4857142857143084,98184.0
201,rna.EB19*,"Peter, son of Zachary, grandson of Judith",58,36,2.5159183673469623,98296.0
202,rna.EB44*,"Edwin, son of Peter, grandson of Zachary",58,37,2.5657142857143094,97296.0
203,rna.EB28*,"Renee, son of Stephen, grandson of Frederick",58,39,2.5395918367347172,98099.0
204,rna.EB4*,"Hilary, son of Rodney, grandson of Geoffrey",60,37,2.508571428571452,97055.0
205,rna.EB33*,"Theresa, son of Jane, grandson of Andrew",58,39,2.5551020408163505,101024.0
206,rna.EB25*,"Richard, son of Virginia, grandson of Anne",53,37,2.550204081632677,98365.0
207,rna.EB3*,"Antoinette, son of Jerome, grandson of Albert",56,34,2.4889795918367574,98393.0
208,rna.EB15*,"Andrew, son of Tamara, grandson of Louis",58,36,2.4881632653061456,98309.0
209,rna.EB14*,"Madeline, son of Nathan, grandson of Victoria",54,32,2.4228571428571652,98611.0
210,rna.EB45*,"Roderick, son of Judith, grandson of Nathan",58,39,2.435102040816349,98479.0
211,rna.EB37*,"Sarah, son of Amanda, grandson of Josephine",55,38,2.4187755102041044,98198.0
212,rna.EB39*,"Victoria, son of Violet, grandson of Abraham",58,39,2.3910204081632878,97221.0
213,rna.EB14*,"Gertrude, son of Paul, grandson of Alan",58,36,2.577959183673493,96794.0
214,rna.EB17*,"Elizabeth, son of Veronica, grandson of Harold",56,37,2.446530612244921,96969.0
215,rna.EB42*,"Nathan, son of Nathan, grandson of Oliver",58,38,2.508571428571452,98121.0
216,rna.EB18*,"Madeline, son of Tamara, grandson of Barnaby",59,40,2.537959183673493,98629.0
217,rna.EB36*,"Elizabeth, son of Dominick, grandson of Dorothy",52,34,2.615510204081657,98244.0
218,rna.EB38*,"Elizabeth, son of Victoria, grandson of William",53,34,2.6342857142857388,98329.0
219,rna.EB13*,"Bonnie, son of Tamsin, grandson of Francis",59,38,2.5861224489796157,97337.0
220,rna.EB35*,"Sarah, son of Frances, grandson of Edwin",62,34,2.542040816326555,98467.0
221,rna.EB42*,"Natasha, son of John, grandson of Abigail",58,38,2.4963265306122677,97456.0
222,rna.EB20*,"James, son of Madison, grandson of Alfred",56,36,2.527346938775534,97322.0
223,rna.EB34*,"Ellen, son of Zachary, grandson of Victor",58,34,2.5273469387755334,98419.0
224,rna.EB46*,"Alan, son of Trenton, grandson of Natasha",55,31,2.4473469387755333,98195.0
225,rna.EB48*,"Beverley, son of Alexandra, grandson of Montmorency",58,35,2.4653061224490016,98190.0
226,rna.EB43*,"Teresa, son of Thomas, grandson of Francesca",57,38,2.492244897959207,98287.0
227,rna.EB46*,"Edmund, son of Edwin, grandson of Samantha",58,35,2.4253061224490016,98396.0
228,rna.EB2*,"Sarah, son of Francesca, grandson of Rebecca",59,35,2.4979591836734927,98416.0
229,rna.EB1*,"Gustav, son of Sarah, grandson of Francesca",52,38,2.515918367346962,98270.0
230,rna.EB4*,"John, son of Francesca, grandson of Jerome",55,37,2.590204081632678,98361.0
231,rna.EB14*,"Angus, son of Susan, grandson of Ronald",55,38,2.4816326530612476,98365.0
232,rna.EB3*,"Adelaida, son of Madeline, grandson of Natasha",52,33,2.5175510204081863,98257.0
233,rna.EB42*,"Francesco, son of Edmund, grandson of Pauline",56,37,2.5510204081632892,97581.0
234,rna.EB44*,"Antoinette, son of Sarah, grandson of Jane",57,37,2.5681632653061466,98375.0
235,rna.EB47*,"Rebecca, son of Emily, grandson of Theodore",54,37,2.508571428571452,98025.0
236,rna.EB27*,"Samuel, son of Katrina, grandson of William",55,34,2.536326530612269,97565.0
237,rna.EB12*,"Rodney, son of David, grandson of Virginia",61,34,2.4604081632653294,98619.0
238,rna.EB40*,"Montague, son of Steven, grandson of William",58,38,2.501224489795941,98480.0
239,rna.EB49*,"Raymond, son of Louis, grandson of Albert",58,42,2.531428571428595,98230.0
240,rna.EB15*,"Dwight, son of Tamsin, grandson of Francesco",58,37,2.5175510204081855,98344.0
241,rna.EB41*,"Franklin, son of Jeremiah, grandson of Tamsin",56,38,2.508571428571452,98168.0
242,rna.EB35*,"Aloysius, son of Alfred, grandson of Veronica",58,40,2.491428571428594,98105.0
243,rna.EB35*,"Mathew, son of Simon, grandson of Michael",55,35,2.4775510204081863,98234.0
244,rna.EB14*,"Sharon, son of Violet, grandson of Simon",55,37,2.440816326530635,98378.0
245,rna.EB39*,"Kimberly, son of Matthew, grandson of William",57,35,2.4563265306122672,98526.0
246,rna.EB41*,"Augustine, son of Judith, grandson of Theodore",58,36,2.5714285714285943,98435.0
247,rna.EB6*,"Teresa, son of Janice, grandson of Virginia",60,40,2.410612244897981,98202.0
248,rna.EB16*,"Spencer, son of Judith, grandson of Calvin",54,39,2.512653061224513,97963.0
249,rna.EB5*,"Bartholomew, son of Spencer, grandson of Judith",55,40,2.5828571428571663,98170.0
250,rna.EB21*,"Natasha, son of Eleanor, grandson of Henry",58,41,2.5869387755102284,98297.0
251,rna.EB4*,"Raymond, son of Margaret, grandson of Edwin",56,37,2.5755102040816564,98049.0
252,rna.EB47*,"Catherine, son of Violet, grandson of Calvin",58,38,2.4636734693877784,97644.0
253,rna.EB0*,"Nichole, son of Mathew, grandson of Herbert",58,36,2.4995918367347167,97882.0
254,rna.EB48*,"Howard, son of Victoria, grandson of Sharon",55,35,2.510204081632676,98444.0
255,rna.EB14*,"Jeffrey, son of Simon, grandson of Edward",54,34,2.4930612244898196,98103.0
256,rna.EB19*,"Simon, son of Susan, grandson of Jeremiah",54,35,2.5591836734694113,98474.0
257,rna.EB48*,"Ethel, son of Victoria, grandson of Vincent",62,37,2.4710204081632883,98197.0
258,rna.EB41*,"Helen, son of Dominick, grandson of Ronald",53,37,2.4506122448979824,97339.0
259,rna.EB7*,"Renee, son of Andrew, grandson of Ethel",58,38,2.52244897959186,98030.0
260,rna.EB48*,"Isabella, son of Catherine, grandson of Vincent",56,38,2.4130612244898173,98481.0
261,rna.EB4*,"Jeremy, son of Alfred, grandson of Charles",58,36,2.4522448979592064,98529.0
262,rna.EB20*,"Walter, son of Margaret, grandson of Sharon",61,39,2.5534693877551256,98266.0
263,rna.EB42*,"Alan, son of Dolores, grandson of Jerome",54,35,2.590204081632677,98291.0
264,rna.EB1*,"Percival, son of Abigail, grandson of Dorothy",62,35,2.36653061224492,98687.0
265,rna.EB28*,"Mary, son of Thomas, grandson of Abigail",54,39,2.5224489795918594,98498.0
266,rna.EB4*,"John, son of Raphael, grandson of Sharon",58,38,2.5934693877551265,98578.0
267,rna.EB15*,"Nichole, son of Russell, grandson of Frances",55,38,2.5616326530612485,98436.0
268,rna.EB9*,"Cassandra, son of Montmorency, grandson of Percival",54,43,2.524081632653085,98462.0
269,rna.EB35*,"Jason, son of Joseph, grandson of Nathaniel",56,41,2.564897959183697,98785.0
270,rna.EB29*,"Edwin, son of Rodney, grandson of Renee",61,37,2.6555102040816574,98377.0
271,rna.EB33*,"Raphael, son of Peter, grandson of Peregrine",54,36,2.5012244897959426,98287.0
272,rna.EB49*,"Renee, son of Raphael, grandson of Peter",58,37,2.493877551020431,97163.0
273,rna.EB43*,"Kimberly, son of Katherine, grandson of Rodney",53,40,2.4718367346939005,98259.0
274,rna.EB29*,"Thomas, son of Benjamin, grandson of Jason",57,36,2.4979591836734922,97573.0
275,rna.EB10*,"Susan, son of Gregory, grandson of Deborah",55,39,2.5559183673469623,98132.0
276,rna.EB3*,"Paul, son of Thomas, grandson of Veronica",59,36,2.6318367346939024,98136.0
277,rna.EB20*,"David, son of Alexander, grandson of Ellen",60,39,2.6285714285714534,98068.0
278,rna.EB7*,"Alastair, son of David, grandson of Alexander",60,40,2.5600000000000236,98402.0
279,rna.EB17*,"Thomas, son of Jeremiah, grandson of Daniel",57,41,2.5289795918367584,97883.0
280,rna.EB48*,"Stephen, son of Mathew, grandson of Spencer",54,36,2.5142857142857378,98402.0
281,rna.EB48*,"Jeremiah, son of Roderick, grandson of Violet",57,40,2.536326530612268,97489.0
